author,description
 ://www facebook com/bbcnews,It comes less than a week after the country suspended more than a million doses due to contamination 
Matt Novak,A    year old woman from Illinois was arrested on Sunday while trying to enter Hawaii with a fake covid    vaccination record card How did authorities know it was fake For starters the counterfeit card said the woman had received the  Maderna  vaccine rath 
Maggie Fox CNN,A head to head study of all three authorized coronavirus vaccines in the United States finds the Moderna vaccine is slightly more effective than Pfizer s in real life use in keeping people out of the hospital and Johnson Johnson s Janssen vaccine comes in  
Reuters,Japan s COVID    vaccination push has been dealt a blow by widening reports of contamination in supplies of Moderna Inc s  a  reuters  companies MRNA O  target   blank   MRNA O   a  COVID    vaccine  a    world asia pacific japans gun 
Igor Bonifacic,Apple has asked all of its US employees to share their vaccination status voluntarily According to Bloomberg the company recently sent out a memo requesting workers whether they currently work out of an office or not to share that information by September 
Ben Rothenberg,Despite the possible consequences of not being vaccinated   illness and the loss of income and opportunity to play   tennis players have been stubbornly slow to get the vaccine 
Roxanne Egan Elliott,   Employers debate whether to make vaccination a condition of employment  Times Colonist   Moderna vs Pfizer  Which COVID    vaccine is better   ABC News In depth   Montreal entices teens to get vaccinated with video games cash prizes   
The New York Times,The state now has the country s lowest percentage of vaccinated residents    and over despite efforts from state officials to reach the hesitant 
The New York Times,The panel is set to meet today to discuss the shots and to vote on whether the agency should approve additional doses for people    and older The meeting comes amid a fraught debate about whether booster shots are needed and for whom Here s the latest on t 
Beth Skwarecki,When Pfizer s COVID    vaccine was approved in August it was only approved for ages    and up as a two dose series But since fully approved vaccines and medications can be used  off label   many of us started wondering if providers could administer the vacc 
Aya Elamroussi CNN,Three quarters of eligible Americans have received at least one dose of a Covid    vaccine and some are now able to receive an additional booster shot But the virus still poses a great threat to more than    million people who remain unvaccinated 
Ashley Wong,Enforcement of a city policy requiring proof of vaccination to dine indoors began Monday Days later a hostess at Carmine s was assaulted after asking three women for their vaccine cards the police said 
Reuters,A contaminant was found in Moderna s COVID    vaccine on Sunday in Japan s Gunma prefecture near Tokyo the latest such case in the country involving the U S company s vaccines 
Reuters,Japan is looking into the possibility of mixing shots of AstraZeneca Plc s  a  reuters  companies AZN L  target   blank   AZN L   a  COVID    vaccine with those developed by other drug makers in a bid to speed up its vaccine rollout the m 
Rocky Swift,   Japan suspends use of another million doses of Moderna s COVID    vaccine as contamination woes widen  The Globe and Mail   What we know about Japan s contaminated Moderna COVID    vaccine supplies  CTV News   Japan detects more Modern 
Reuters,Japan s health ministry said on Wednesday that contaminants found in suspended Moderna Inc  MRNA O  COVID    vaccines were particles of stainless steel and it did not expect they would pose an additional health risk  a    business healthcare pharmaceuti 
Reuters,Moderna Inc  a  reuters  companies MRNA O  target   blank   MRNA O   a  said on Friday it had asked the EU drugs regulator for conditional approval of a booster shot of its COVID    vaccine at a    microgram dose 
Jack Healy Richard Fausset and J David Goodman,Some employers and business groups welcomed the new coronavirus requirements but many G O P leaders issued outright condemnations 
Canadian Press,   A look at COVID    vaccine certificate programs across Canada  CollingwoodToday   Covid    Australia  One million doses of Moderna to boost vaccine rollout from next week   news  au   Australia s leading news site  NEWS  au   Fir 
None,Moderna Inc  a  reuters  companies MRNA O  target   blank   MRNA O   a  Chief Executive St phane Bancel thinks the coronavirus pandemic could be over in a year as increased vaccine production ensures global supplies he told the Swiss news 
None,United Airlines has achieved a high level of compliance with the strict vaccine mandate it set for its        US employees But the airline s CEO doesn t believe expanding that requirement to passengers is a good idea 
The New York Times,Mr Biden s novel use of a law on workplace safety is at the heart of legal threats from Republican leaders Catch up on pandemic updates 
Reuters,The U S Centers for Disease Control and Prevention said no deaths had been reported in young adults after a rare heart inflammation known as myocarditis a known side effect of COVID    vaccines made by Pfizer Inc  a  reuters  companies P 
Reuters Inc ,   Moderna to supply    million doses of COVID    vaccine to Peru   Saltwire  SaltWire Network   Man punched nurse after he said wife received COVID    vaccine without his permission police said  WSB Atlanta   Check out where to receive  
Praveen Menon,   New Zealand reports death of woman after Pfizer COVID    vaccine  CTV News   New Zealand reports first death linked to Pfizer COVID    vaccine  Vancouver Sun   New Zealand woman dies after receiving Pfizer vaccine  BBC News   N 
Victoria Song,After you install iOS    on your iPhone you  be able to store verifiable versions of your covid    vaccination and test results records in the Health app Later this year an iOS    update will also allow you to add and present a verifiable covid    vaccin 
None,Some health experts in Singapore are calling for mandatory vaccination against the coronavirus with a growing toll of severe COVID    among unvaccinated people as infections surge and with vaccine take up plateauing at     of the population 
Reuters,The U S government s plan to roll out additional shots of the COVID    vaccine for the general public on Sept    will proceed with just the Pfizer  a  reuters  companies PFE N  target   blank   PFE N   a  BioNTech SE vaccine a source  
Reuters Staff,Takeda Pharmaceutical Co said on Tuesday the Japanese government agreed to purchase     million doses of the COVID    vaccine it will produce using Novavax Inc s formula 
Elizabeth Joseph CNN,A hospital in upstate New York is  pausing  deliveries of babies because of the number of maternity unit employee resignations over the state s Covid    vaccination requirements health officials say 
Ian Sample Science editor,JCVI recommends Pfizer BioNTech jab be used as booster regardless of vaccine received first time around  Coronavirus   latest updates   See all our coronavirus coverage   Covid boosters will be offered to all over   s and those at severe ri 
Reuters Editorial,Japan reported a fresh contamination case involving Moderna s COVID    vaccine the fourth such incident in less than a week threatening to slow the country s sputtering inoculation campaign Olivia Chan reports 
Mike Winters,In the pandemic era it s easy to forget about another important inoculation the flu vaccine While we got off lightly in      health experts are suggesting that flu season could be much worse this year even more reason to get your shot this fall For furthe 
Ginia Bellafante,Lawsuits will inevitably follow federal mandates to vaccinate   and they may come from surprising quarters 
gdean insider com (Grace Dean),Authorities arrested the woman over allegations she used a fake vaccine card to bypass Hawaii s    day quarantine Hawaii News Now reported 
Reuters,   Japan s Gunma prefecture reports contaminant in Moderna COVID    vaccine  Yahoo News Canada   COVID    presents greater blood clot risk than vaccines study finds  CTV News   All About the Moderna Pfizer and Johnson Johnson Vaccine 
Robby Soave,Vaccines work But a mandate by the federal executive is an overreach that may backfire 
Reuters Staff,Australia will expand its COVID    vaccination drive on Monday to include around one million children aged       as it secures additional supplies in a bid to step up the pace of its inoculation amid a surge in infections 
Reuters,The Czech government will offer a booster COVID    vaccine shot from Sept    to any previously vaccinated person Health Minister Adam Vojtech said on Monday 
The New York Times,Ursula von der Leyen president of the bloc s executive arm hailed European countries  successful vaccination efforts but called the unequal distribution of doses globally an  injustice  
Kevin Nielsen,   Hours being reduced at Waterloo Region s largest COVID    vaccination clinic  Global News   Region reports    new COVID cases Tuesday  KitchenerToday      new cases of COVID    in Waterloo region as major vaccination clinic winds d 
insider insider com (Connor Perrett),It s likely that the Pfizer vaccine will get authorization for use in young children before the Moderna vaccine he said 
None,The government of the Australian state of New South Wales  NSW  said on Monday the pace of COVID    vaccinations had slowed as first dose coverage neared     and urged the unvaccinated to get shots soon or risk missing out on freedoms when curbs ease 
Reuters Editorial,Japan reported a fresh contamination case involving Moderna s COVID    vaccine the fourth such incident in less than a week threatening to slow the country s sputtering inoculation campaign 
Reuters Editorial,Moderna said on Thursday it is developing a single vaccine that combines a booster dose against COVID    with its experimental flu shot Conway G Gittens reports 
None,The United States has administered             doses of COVID    vaccines as of Sunday morning and distributed             doses the U S Centers for Disease Control and Prevention said 
Melissa Healy Amina Khan,   Big gap between Pfizer Moderna vaccines seen for preventing COVID hospitalizations  Yahoo Movies Canada   Here are the only reasons you would be exempt from a COVID    vaccine in B C   Global News   Coronavirus  What s happening in Ca 
Tom Frieden,By issuing Covid    vaccination verification guidelines the federal government can help verifiers ensure that mandates are effective 
None,Data needed to determine the advisability of booster shots of the Moderna Inc  a  reuters  companies MRNA O  target   blank   MRNA O   a  and Johnson Johnson  a  reuters  companies JNJ N  target   blank   JNJ N   a  C 
None,   Health officials to offer     gift cards at Long County vaccine event  WJCL News   Greenwich Health Dept  Kids COVID and Pregnant Women  Greenwich Free Press   View Full coverage on Google News  
Jennifer Steinhauer,The military and Department of Veterans Affairs see vaccination rates increase as do some companies and states but they have a long way to go 
 ://www facebook com/bbcnews,The study adds to growing evidence that vaccination helps protect against coronavirus in a number of ways 
Ben Quinn,Police stop attempt to invade MHRA headquarters as hundreds gather in Canary Wharf  Coronavirus   latest updates   See all our coronavirus coverage   Police have prevented anti vaccine protesters from storming the headquarters of Britain s  
None,   Quebec s vaccination passport now available on Google Play  CTV Montreal   Quebec reports     new COVID    cases  Montreal Gazette   Quebec reports     new COVID    cases no deaths as hospitalizations drop  The Globe and Mail   l 
Mia Rabson,   Calgary firm advances new trial manufacturing of mRNA vaccine for COVID     CP   Toronto s Breaking News   Emergent to make Calgary based Providence Therapeutics potential COVID    vaccine  CBC ca    Abysmal   Canadian vaccine maker  
Jon Fingas,There s a real chance you  need proof of a COVID    vaccination to enter certain venues and Apple is hoping it can save you the hassle of digging up an email or carrying a physical card in your pocket The company is bringing verifiable COVID    vaccinatio 
Abrar Al Heeti, She probably chose Maderna because she knew she couldn t spell Fizur   quips one Twitter user 
The New York Times,The mandate which affects well over         people working in the nation s largest school system was set to go into effect on Monday at midnight 
Alan Blinder,With forfeits possible this year teams see vaccinations as competitive advantages prompting locker room campaigns to drive rates higher 
None,Efforts to develop an African base for COVID    vaccine production will focus on trying to replicate Moderna s  a  reuters  companies MRNA O  target   blank   MRNA O   a  shot but a lack of progress in talks with the U S company mean the 
Madeline Holcombe CNN,As officials in the United States debate vaccine boosters and requirements a CNN analysis of Johns Hopkins University  JHU  and US Census Bureau data shows about one in     residents has died of Covid    
None,German biotech firm CureVac  a  reuters  companies  CV DE  target   blank    CV DE   a  said on Tuesday it cancelled contract manufacturing deals for its experimental COVID    vaccine with two prospective partners after rivals with approv 
Lara Jakes and Sheryl Gay Stolberg,The U N backed vaccine program is so far behind schedule that not even    percent of the population in poor countries is fully vaccinated experts say 
David Smith in Washington,In low income countries fewer than    of the population has received a shotJoe Biden convenes a virtual coronavirus summit of world leaders on Wednesday under pressure to close the vaccination gap with poorer nations The meeting on the margins of the UN gener 
None,Demonstrators have been marching against lockdowns and mandatory vaccines in Australia s second largest city 
Jack Healy and Lauren McCarthy,In remarks on Friday the president said his mandates would prevail and expressed disappointment with Republican governors who  have been so cavalier with the health of these kids so cavalier with the health of their communities  
None,The United States has administered             doses of COVID    vaccines in the country as of Monday morning and distributed             doses the U S Centers for Disease Control and Prevention said 
Reuters,Takeda Pharmaceutical Co  a  reuters  companies      T  target   blank        T   a  said on Tuesday the Japanese government agreed to purchase     million doses of the COVID    vaccine it will produce using Novavax Inc s  a     
None,   Calgary firm advances new trial manufacturing of mRNA vaccine for COVID    Canada News  Castanet net   Chinese firm buys Canadian mRNA vaccine technology despite apparent resistance to western shots  Financial Post   View Full cover 
None,The Ukrainian government has decided to introduced COVID     vaccine passports  verifying citizens vaccination status the health ministry said on Monday 
Matt Novak,The government of North Korea rejected almost   million doses of China s covid    vaccine Sinovac this week claiming they should be sent to countries that are struggling with the coronavirus pandemic according to U S state financed broadcaster Voice of Ame 
KitchenerToday Staff,   Pinebush clinic to start to wind down operations  KitchenerToday      new cases of COVID    in Waterloo region as major vaccination clinic winds down  CBC ca   Waterloo school board to ask province to add COVID    vaccine to mandat 
Aya Elamroussi CNN,Twenty six states in the US have fully vaccinated more than half of their population federal data shows but some hospitals are still filling up with Covid    patients who did not get their shots 
Zeke Miller,   U S COVID    booster shot plan faces complications some may miss Sept     CP   Toronto s Breaking News   U S FDA vaccine advisers face thorny question  Are COVID    boosters needed   CBC ca   More than        U S children tested p 
Reuters,Walmart Inc  a  reuters  companies WMT N  target   blank   WMT N   a  on Tuesday became the latest U S retailer to say that it is ready to administer millions of COVID    booster vaccine doses this fall if U S health officials endorse su 
Tom Murphy,   COVID    vaccine boosters could mean billions for drugmakers  CTV News   Ontario First Nation residents given expired coronavirus Pfizer vaccine  CP   Toronto s Breaking News    I chose not to get the vaccine   BC COVID    patient plea 
Ginia Bellafante,Vaccine hesitancy remains strong while students under    are still vulnerable 
Sangmi Cha,South Korea plans to begin giving out COVID    booster shots from October joining several countries that have approved such doses amid resurgent infections and concern that vaccine protection wanes over time 
None,As more adults get their COVID    vaccines children who are not yet eligible for vaccination in most countries are representing a larger percentage of hospitalizations and even deaths the Pan American Health Organization  PAHO  warned on Wednesday 
Mason DePatie,   Proof of COVID    vaccination now available for those without Manitoba health cards  CTV News Winnipeg   WHO warns of         more COVID deaths in Europe by December  Al Jazeera English   Schools across Europe must stay open say WHO a 
Reuters,Greece on Thursday offered unvaccinated health care workers a second chance to get a shot against COVID    and allow those who have been already suspended to return to work as hundreds of them protested against mandatory vaccination 
Beth Skwarecki,The most important thing that the COVID vaccines do is prevent deaths and severe illness from COVID    The next most important thing they do is prevent many cases of milder illness a job they re not perfect at but it s still far better to be vaccinated than 
None,The United States  a  reuters  world us us cdc advisers recommend covid    vaccine boosters    older high risk             target   blank  is rolling out booster shots  a  of the Pfizer Inc  a  reuters  companies PFE N  
None,South Africa s health regulator has approved Pfizer s  a  reuters  companies PFE N  target   blank   PFE N   a  COVID    vaccine for use by children aged    and older paving the way for the government to offer vaccinations to teenagers 
None,    of adults in the United States have received at least one dose of a COVID    vaccine as of Tuesday morning the U S Centers for Disease Control and Prevention said 
Sweta Jaiswal FRM,Moderna is expected to gain on approval for booster shots and new positive data on its COVID    vaccine 
Reuters,The European Centre for Disease Prevention and Control  ECDC  said on Wednesday there was no urgent need for booster doses of COVID    vaccines for the fully vaccinated citing data on the effectiveness of shots 
None,Peter Thiel backed AbCellera Biologics Inc  a  reuters  companies ABCL O  target   blank   ABCL O   a  said on Wednesday it had entered a multi year agreement with COVID    vaccine maker Moderna Inc  a  reuters  compani 
The New York Times,The agency appears likely to approve a third Pfizer dose for older Americans and those vulnerable to severe Covid    It s preparing to address other big questions in coming weeks including vaccines for children under    
Tom McKay,The state of Arizona is preemptively suing Joe Biden s administration over its forthcoming vaccine mandate even though the text of the rule isn t published yet and it remains unclear when that will happen Read more 
Lara Jakes and Sheryl Gay Stolberg,The U N backed vaccine program is so far behind schedule that not even    percent of the population in poor countries is fully vaccinated experts say 
 ://www facebook com/bbcnews,The move applies to Americans over    who were vaccinated with Pfizer and those at high Covid risk 
Reuters,      vaccines hold strong against Delta protection waning in older adults  Financial Post   NACI recommends third COVID    vaccine dose for immunocompromised   News  Daily Hive   Italy approves booster COVID    shots for vulnerable grou 
None,Vietnam has pushed back a plan to re open the resort island of Phu Quoc to foreign tourists until November after failing to meet targets for inoculating residents due to insufficient vaccine supplies state media reported 
Ian Sample Science editor,Half a million people will be offered another vaccine shot with a decision on autumn boosters yet to be reached  Coronavirus   latest updates   See all our coronavirus coverage   Half a million people in the UK who have severely weakened i 
None,The United States has administered             doses of COVID    vaccines in the country as of Sunday morning and distributed             doses the U S Centers for Disease Control and Prevention said 
Reuters,The United States has administered             doses of COVID    vaccines in the country as of Thursday morning and distributed             doses the U S Centers for Disease Control and Prevention said 
CTV News Edmonton,   Alberta to offer booster shots to seniors in care facilities immunocompromised people  CTV Edmonton   Alberta rolls out third COVID shot for some as province sees       new cases  Calgary Herald   Quebec  will be ready  to roll out CO 
Sharon Otterman and Joseph Goldstein,With a Monday deadline looming thousands of health care workers in the state are risking their jobs by not getting a coronavirus vaccine 
Reuters,The United States has administered             doses of COVID    vaccines in the country as of Sunday morning and distributed             doses the U S Centers for Disease Control and Prevention said 
